Sort,ID,Type,Input Text,Explanation,What does the model predict?,"How helpful do you find the explanation for guessing the model prediction?

1 (not helpful) 
- 7 (very helpful)","How easy is the explanation to understand?


1 (very difficult) 
- 7 (very easy)"
1,1313,GPT,"""another fantastic offering from the monkey island team and though it was a long time coming and had to survive the departure of ron gilbert it ' s another worthy installment . my only grip e is that it was a little short seeming in comparison to the previous two , though that might be because of a glorious lack of disk-swapping . roll on mi 4 .""","The sentiment analyzer predicted this movie review as '{placeholder}' because 
words such as ""fantastic,"" ""offering,"" ""survive,"" ""worthy,"" and ""glorious"" have high importance scores indicating {placeholder} in the review. Although there are some {placeholder} words such as ""long time coming"" and ""short seeming,"" they have relatively lower importance scores and do not significantly impact the overall {placeholder} sentiment of the review.",Positive sentiment,6,5
2,2677,HM,,,Positive sentiment,4,2
3,51,ER,"""a great historical movie , will not allow a viewer to leave once you begin to watch . view is presented differently than displayed by most school books on this subject . my only fault for this movie is it was photographed in black and white ; wished it had been in color . . . wow !""",great wow not ! for,Positive sentiment,3,2
4,2186,GPT,scary in places though the effects did leave something to be desired unless you have bad eyes ight or are afraid of the dark . however most of the acting was convincing and most of the effects were well done . i thought the creature looked a bit too much like a man in a gorilla suit for my liking . it reminded me of the original pink panther film .,"The sentiment analyzer has predicted this movie review as '{placeholder}' 
because of the negative importance scores associated with words like ""though"", ""did leave something to be desired"", ""are afraid of the dark"", ""most of the acting was not convincing"", and ""too much like a man in a gorilla suit"". These negative scores outweigh the positive scores associated with words like ""convincing acting"", ""well-done effects"", and ""gorilla suit"".",Negative sentiment,5,5
5,20994,SMV,not the funniest movie ever . . . . . but i have to watch this film at least once a year just so i can fall in love with michelle johnson all over again . she never looked better than she did in this film . by the way the story is good too .,"The phrase 
» way the story is good « 
was most important to the model.",Positive sentiment,5,4
6,70,SMV,"""fantastic , madonna at her finest , the film is funny and her acting is brilliant . it may have been made in the 80 ' s but it has all the qualities of a modern hollywood block - buster . i love this film and i think its totally unique and will cheer up any dr oop y person within a matter of minutes . fantastic .""","The span » . i love this film and i « 
is most important for the prediction.",Positive sentiment,6,4
7,1313,HM,,,Positive sentiment,4,4
8,2245,GPT,"""i think that just sums up this film . watch it and you ' ll find out why . the acting of the lead character john keem is really , really bad and he has no on screen charisma whatsoever . it ' s very funny because of this thought , as is the ending where keem be heads the bad guy despite the fact he is unarmed and has surrendered . brilliant !""","The sentiment analyzer has predicted this movie review as '{placeholder}' 
because of the high importance scores assigned to words such as ""bad"", ""no"", ""unarmed"", and ""surrendered"". These words indicate {placeholder} aspects of the movie, particularly in relation to the lead character's acting and the ending. The overall tone of the review is also {placeholder}, as indicated by the low importance scores for {placeholder} words such as ""brilliant"" and ""funny"".",Negative sentiment,6,6
9,21109,GPT,"if you like bad movies , this one ' s a real treat . kaufman & peters stagger around in robot costumes , escape slavery only to wander aimlessly , and find true robot love . i believe this is the first movie that ever made me consider walking out . i should note i was 12 , and could be entertained by shiny objects .","The sentiment analyzer has predicted this movie review as '{placeholder}' 
because of the high importance scores for words like ""real"", ""treat"", ""love"", and ""entertained"". These words indicate a {placeholder} experience for the reviewer and contribute heavily to the overall sentiment of the review. Additionally, the negative importance scores for words like ""bad"" and ""aimlessly"" suggest that the {placeholder} aspects of the movie were not significant enough to outweigh the {placeholder} experiences.",Negative sentiment,4,3
10,1128,ER,"""i really liked this picture , because it realistically dealt with two people in love , and one of them having a disorder . though the ending saddened me , i know that that was the best way for it to finish off . i would recommed this to everyone .""",liked recommed best love off,Positive sentiment,6,5
11,22697,ER,"this was an absolute disgrace ! the worst dramatisation i have ever seen . german officer ' s with a spotless english accent , they didn ' t even attempt to be german . how were we supposed to take them seriously ? garbage garbage garbage ! leave the german acting to the likes of ralph fiennes & liam neeson in future .",disgrace worst garbage ! absolute,Negative sentiment,6,6
12,20552,SMV,"i just cant see what everyone sees in this movie . the acting is just awful , the choice of music is , mildly putting it , peculiar , there arent enough fighting scenes , the plot is non - existent and whatever small entertainment one could get from this film is ruined by the annoying way some of the movie is filmed and gives you a splitting headace .","The phrase 
» this film is ruined by the annoying way « 
is most important for the prediction.",Negative sentiment,6,7
13,22550,GPT,"the "" film "" consists of the audition tapes of the "" surrender girls "" and some footage from previous films . it ' s not hot or even suitable for late night viewing on cinemax . only an adolescent boy could be interested in auditions from beyond . i recommend avoiding this one .","The sentiment analyzer has predicted this movie review as '{placeholder}' 
because of the high importance scores assigned to words such as ""not hot"", ""avoiding"", and ""only an adolescent boy could be interested"". These words have a {placeholder} connotation and contribute to the overall {placeholder} sentiment of the review. Additionally, the importance scores for words such as ""surrender girls"" and ""previous films"" suggest that the reviewer did not find the content of the movie enjoyable or engaging.",Negative sentiment,5,6
14,20552,HM,,,Negative sentiment,6,5
15,2173,SMV,"""john cusack stars as hoops in this silly little movie that has to be one of the best of the eighties teen comedies . believe it or not demi moore is his co star . . . if you love the eighties , grew up around that time , or are an angst ridden teenage artist get ready to laugh . wait until you see the cartoons . . what a riot . . . .""","The word » riot « 
is most important for the prediction, 
but the phrase » this silly little « is also salient.",Negative sentiment,5,5
16,20590,HM,,,Negative sentiment,2,3
17,24783,GPT,"i usually like period films but this one just seemed to drag and drag . i ' d perk up during rupert graves ' scenes , but vanessa redgrave just put me to sleep . < br / > < br / > i was disappointed in the film . it lacked a little "" punch "" at the end that i ' d hoped it would have .","The sentiment analyzer has predicted this movie review as '{placeholder}' because 
words like ""drag"", ""put me to sleep"", ""disappointed"", and ""lacked punch"" have high importance scores for predicting {placeholder} sentiment. Additionally, the positive scores for words like ""period films"" and ""Rupert Graves"" are not enough to overcome the {placeholder} sentiment conveyed by the rest of the review.",Negative sentiment,5,5
18,2518,HM,,,Positive sentiment,4,4
19,21163,GPT,officially the first martial arts movie in ussr cinematography featuring actual martial artists like tadeush kas ' yanov and russian bruce lee - talgat nigmatullin . bad people highjack a ship in the high seas but fortunately just about everybody on board is a trained martial artist . a collectible for martial arts aficionado .,"The sentiment analyzer has predicted this movie review as '{placeholder}' because 
words like 'officially', 'martial arts', 'cinematography', 'featuring', 'actual', 'trained', 'collectible', and 'fortunately' have high positive importance scores. These words indicate that the movie is significant, well-made, and enjoyable to watch. Additionally, words like 'bad people' and 'Russian Bruce Lee' have negative importance scores, indicating that they do not significantly affect the overall {placeholder} sentiment of the review.",Positive sentiment,5,4
20,43,ER,"""as a history of custer , this insn't even close ( custer dies to help the indians ? i am sure the other members of the 7th cav weren' t consulted in that decision . ) but as a western , this is fun . flynn looks , and acts , the part of the dashing cavalier . and the """" garry owen """" is always nice to hear !""",fun Flynn nice always !,Positive sentiment,4,3
21,20647,HM,,,Negative sentiment,6,5
22,22665,GPT,"i found this movie really hard to sit through , my attention kept wandering off the tv . as far as romantic movies go . . this one is the worst i ' ve seen . don ' t bother with it .","The sentiment analyzer has predicted this movie review as '{placeholder}' 
because of the high importance scores given to words such as 'hard', 'wandering', 'worst', 'don't bother', and 'the worst'. These words indicate a {placeholder} experience while watching the movie and contribute significantly to the overall {placeholder} sentiment of the review. Additionally, the high importance score given to 'tv' suggests that the reviewer was not fully engaged with the movie, further supporting the {placeholder} sentiment.",Negative sentiment,5,5
23,22697,HM,,,Negative sentiment,6,6
24,1031,HM,,,Positive sentiment,6,6
25,1031,GPT,"""i just saw """" eagle ´s wing """" . i do not really know why this movie was made . what is the message of this story ? nevertheless i liked it . there are some exciting scenes in it . i appreciate a strong performance by martin sheen . harvey keitel is less convincing .""","The sentiment analyzer has predicted this movie review as '{placeholder}' 
because of the high importance scores given to words like ""liked"", ""strong"", ""performance"", and ""appreciate"". These words suggest a {placeholder} evaluation of the movie. Additionally, the positive scores for words like ""really"", ""exciting"", and ""some"" further support the {placeholder} sentiment. However, it should be noted that the negative scores for words like ""nevertheless"", ""less convincing"", and ""eagle's wing"" may indicate some {placeholder} feelings towards the movie.",Positive sentiment,6,5
26,23060,GPT,"a truly masterful piece of filmmaking . it managed to put me to sleep and to boggle my mind . so boring that it induces sleep and yet so ludicrous that it made me wonder how stuff like this gets made . avoid at all costs . that is , unless you like taking invisible cranial punishment , in which case i highly recommend it .","The sentiment analyzer has likely predicted this movie review as '{placeholder}' 
because of the high importance scores given to words such as ""masterful"", ""filmmaking"", ""induces"", ""ludicrous"", and ""highly recommend"". These words have {placeholder} connotations and likely influenced the sentiment analyzer's prediction. However, the overall tone of the review is {placeholder}, as indicated by the negative importance scores given to words such as ""boring"" and ""avoid"".",Positive sentiment,4,5
27,24783,ER,"i usually like period films but this one just seemed to drag and drag . i ' d perk up during rupert graves ' scenes , but vanessa redgrave just put me to sleep . < br / > < br / > i was disappointed in the film . it lacked a little "" punch "" at the end that i ' d hoped it would have .",disappointed seemed drag drag sleep,Negative sentiment,5,4
28,1128,GPT,"""i really liked this picture , because it realistically dealt with two people in love , and one of them having a disorder . though the ending saddened me , i know that that was the best way for it to finish off . i would recommed this to everyone .""","The sentiment analyzer has predicted this movie review as '{placeholder}' because 
words like 'liked' (3.63) and 'best' (0.2) have high positive importance scores. Additionally, words like 'realistic' (0.05) and 'love' (0.32) also contribute {placeholder} to the sentiment. Despite the sad ending, the sentiment analyzer has likely picked up on the overall {placeholder} tone of the review.",Positive sentiment,6,5
29,326,HM,,,Positive sentiment,6,5
30,24714,GPT,"i couldn ' t even sit through the whole thing ! this movie was a piece of crap ! i had more fun watching "" dont ' tell mom the babysitter ' s dead "" ! it was just too painful to watch . say , besides "" austin powers "" , has tom arnold ever been in a hit movie ?","The sentiment analyzer has predicted this movie review as {placeholder} because 
words like ""crap"" (0.3), ""painful"" (0.21), and ""couldn't even sit through the whole thing"" (0.05) have high importance scores indicating a strong {placeholder} sentiment. Additionally, words like ""piece of"" (0.09) and ""too"" (0.04) also contribute to the {placeholder} sentiment.",Negative sentiment,6,6
31,1389,ER,i thought this movie was awesome and the two guys nick and aaron are hotties ! ! ! ! ! i wish i could watch it over and over . i loved the plot and whole concept of the movie . it is great and i wish i had taped it last night . nick i love you ! ! ! ! ! !,great awesome loved !!!!! It,Positive sentiment,7,6
32,51,GPT,"""a great historical movie , will not allow a viewer to leave once you begin to watch . view is presented differently than displayed by most school books on this subject . my only fault for this movie is it was photographed in black and white ; wished it had been in color . . . wow !""","The sentiment analyzer has predicted this movie review as '{placeholder}' because words such as 'great', 'historical', 'viewer', 'begin', 'subject', 'fault', and 'movie' have high importance scores. These words indicate that the review has {placeholder} opinions about the movie and its historical significance, and that it is engaging for the viewer. Additionally, the use of 'wow' and exclamation marks at the end of the review also suggest a {placeholder} sentiment. However, the importance scores also indicate that the reviewer had a {placeholder} opinion about the movie being in black and white, but this was not enough to override the overall {placeholder} sentiment.",Positive sentiment,6,6
33,21163,HM,,,Positive sentiment,5,4
34,22593,ER,"the movie is not that bad , ringo lam sucks . i hate when van damme has love in his movies , van damme is good only when he doesn ' t have love in his movies .",sucks bad love hate love,Negative sentiment,6,6
35,129,HM,,,Positive sentiment,5,4
36,2245,ER,"""i think that just sums up this film . watch it and you ' ll find out why . the acting of the lead character john keem is really , really bad and he has no on screen charisma whatsoever . it ' s very funny because of this thought , as is the ending where keem be heads the bad guy despite the fact he is unarmed and has surrendered . brilliant !""",Brilliant sums bad funny thought,Negative sentiment,1,2
37,24714,SMV,"i couldn ' t even sit through the whole thing ! this movie was a piece of crap ! i had more fun watching "" dont ' tell mom the babysitter ' s dead "" ! it was just too painful to watch . say , besides "" austin powers "" , has tom arnold ever been in a hit movie ?","The phrase 
» it was just too painful to « 
is most important for the model's prediction.",Negative sentiment,6,6
38,24714,HM,,,Negative sentiment,2,3
39,20696,GPT,"i did not like this film at all : the scenario is boring - and after a while , its primitive predictability really gets on your nerves . even if you give chabrol a high bonus for not being a beginner , i did not manage to find anything specially interesting on his characterization of mika neither .","The sentiment analyzer has predicted this movie review as '{placeholder}' 
because of the negative importance scores associated with words such as 'boring', 'primitive', 'predictability', 'nerves', and 'not interesting'. These words have a significant {placeholder} impact on the sentiment of the review, leading the analyzer to predict a {placeholder} sentiment overall.",Negative sentiment,5,5
40,1110,SMV,the theme is controversial and the depiction of the hypocritical and sexually starved india is excellent . nothing more to this film . there is a lack of good dialogues ( why was the movie in english ? ? ) . there was lack of continuity and lack of passion / emotion in the acting .,"The span » india is excellent . « 
is most important for the outcome.",Positive sentiment,7,6
41,20647,SMV,"second nature will not go down as one of the worst tv movies of 2003 , but perhaps the worst of all time . formulaic , derivative , and every performance phoned in , from far , far away . everyone associated with this project should have a hard time looking in the mirror .","Both phrases 
» worst tv movies of «
and » hard time looking «
are salient.",Negative sentiment,6,6
42,2518,GPT,"""excellent movie about a big media firm and the goings on both on and off camera . covering several years , the film centers on 3 upwardly mobile , young hopefuls , all striving for their place within the corporation . well written dialogue , flawless acting , and a riveting story made for 2 hours of solid entertainment .""","The sentiment analyzer has predicted this movie review as '{placeholder}' 
mainly because of the high importance scores given to words like 'excellent', 'well-written', 'flawless acting', 'solid entertainment', and 'several years'. These words suggest that the movie is of high quality, well-executed, and engaging, which are all {placeholder} attributes that contribute to a {placeholder} sentiment. Additionally, the importance scores given to words like 'young hopefuls', 'upwardly mobile', and 'ri-veting story' suggest that the movie has relatable characters and a compelling plot, which also contribute to a {placeholder} sentiment.",Positive sentiment,6,6
43,22593,SMV,"the movie is not that bad , ringo lam sucks . i hate when van damme has love in his movies , van damme is good only when he doesn ' t have love in his movies .","The words 
» sucks « and » bad , « 
are most indicative of the model's sentiment label.",Negative sentiment,6,6
44,24630,GPT,"a bad bad movie . . . terrible plot , hinges on bolo yeung ' s charater , but he speaks maybe 20 words in the entire movie and only has one fight scene - still in great shape considering he was also in the kung fu classic "" enter the dragon "" interesting to see william zabka ( "" johnny "" from the karate kid ) in another martial - arts role .","The sentiment analyzer has predicted this movie review as '{placeholder}' because 
words like 'bad', 'terrible', 'hinges', 'only', 'fight', 'classic', and 'role' have relatively high importance scores. These words suggest that the movie has a weak plot, uninteresting characters, and lacks action. Additionally, the word 'negative' has a high importance score, which further supports the sentiment analyzer's prediction.",Negative sentiment,5,6
45,326,ER,a wonderful story about the consequences of obsessive love with the beautiful romantic back streets of paris as its location . we ' re transported through time and see the plot develop from the perspectives of the three main characters as the mystery unwinds .,wonderful unwinds characters romantic love,Positive sentiment,5,5
46,24714,ER,"i couldn ' t even sit through the whole thing ! this movie was a piece of crap ! i had more fun watching "" dont ' tell mom the babysitter ' s dead "" ! it was just too painful to watch . say , besides "" austin powers "" , has tom arnold ever been in a hit movie ?",painful crap ! ! too,Negative sentiment,5,4
47,21163,ER,officially the first martial arts movie in ussr cinematography featuring actual martial artists like tadeush kas ' yanov and russian bruce lee - talgat nigmatullin . bad people highjack a ship in the high seas but fortunately just about everybody on board is a trained martial artist . a collectible for martial arts aficionado .,Bad fortunately everybody collectible arts,Negative sentiment,4,4
48,24759,SMV,"this may just be the worst movie ever produced . worst plot , worst acting , worst special effects . . . be prepared if you want to watch this . the only way to get enjoyment out of it is to light a match and burn the tape of it , knowing it will never fall into the hands of any sane person again .","The phrase 
» just be the worst movie ever produced « 
is most important for the prediction.",Negative sentiment,6,6
49,70,GPT,"""fantastic , madonna at her finest , the film is funny and her acting is brilliant . it may have been made in the 80 ' s but it has all the qualities of a modern hollywood block - buster . i love this film and i think its totally unique and will cheer up any dr oop y person within a matter of minutes . fantastic .""","The sentiment analyzer has predicted this movie review as '{placeholder}' because words such as 'love', 'fantastic', 'unique', 'cheer', and 'finest' have high importance scores indicating {placeholder}. Additionally, words such as 'funny', 'qualities', 'modern', and 'blockbuster' also have positive importance scores. However, the importance scores of words such as 'acting', 'made', and 'Hollywood' are negative, but they do not seem to have a significant impact on the overall {placeholder} sentiment prediction.",Positive sentiment,6,6
50,1110,GPT,the theme is controversial and the depiction of the hypocritical and sexually starved india is excellent . nothing more to this film . there is a lack of good dialogues ( why was the movie in english ? ? ) . there was lack of continuity and lack of passion / emotion in the acting .,"The sentiment analyzer has predicted this movie review as '{placeholder}' 
because of the high importance scores given to words like ""excellent"" and ""good dialogues"". Additionally, the positive scores given to words like ""India"" and ""passion/emotion"" also contribute to the overall {placeholder} sentiment prediction. However, the negative scores given to words like ""sexually starved"" and ""lack of continuity"" suggest that there are some {placeholder} aspects to the movie as well.",Positive sentiment,6,6
51,22593,HM,,,Negative sentiment,6,5
52,20647,ER,"second nature will not go down as one of the worst tv movies of 2003 , but perhaps the worst of all time . formulaic , derivative , and every performance phoned in , from far , far away . everyone associated with this project should have a hard time looking in the mirror .",worst Everyone Formulaic worst away,Negative sentiment,5,4
53,1994,SMV,i would just like to say that the cure was a fabulious movie to help inform how people who are hiv positive have to function in life . expecially a young boy who can t go to school because he could contaminate someone . and the ignorance of the boys who called them faggots . that just shows how much children are not educated about aids .,"The word » just « 
as well as the phrase » movie to help inform « 
were used by the model to predict this sentiment label.",Positive sentiment,3,3
54,67,HM,,,Positive sentiment,4,5
55,24678,GPT,"this is probably the worst film i have ever seen . mike myers tries to be a dramatic actor and fails miserably . the children , who have the major roles , are almost impossible to understand and are really unpleasant characters . it was not even worth the price of the rental .","The sentiment analyzer has predicted this movie review as {placeholder} because 
words such as ""worst"", ""fails"", ""impossible"", and ""unpleasant"" have high negative importance scores. Additionally, the overall tone of the review is {placeholder}, with the reviewer stating that the movie is not worth the rental price.",Negative sentiment,5,5
56,20994,GPT,not the funniest movie ever . . . . . but i have to watch this film at least once a year just so i can fall in love with michelle johnson all over again . she never looked better than she did in this film . by the way the story is good too .,"The sentiment analyzer has predicted this movie review as '{placeholder}' because 
the words 'funnies', 'ever', 'film', 'good', and 'way' have high importance scores for predicting {placeholder}. Additionally, the words 'watch', 'year', 'love', and 'story' also have relatively high importance scores. These words suggest that the reviewer enjoys the movie and finds it worth watching repeatedly, indicating {placeholder} sentiment. The importance scores also suggest that the reviewer appreciates the actress Michelle Johnson and considers the story to be good. However, there are also some negative importance scores for words such as 'never', 'looked', 'better', and 'too', which may indicate some criticisms or reservations about the movie.",Positive sentiment,5,5
